{
  "schema_version": "architecture-exam-coverage/1.0",
  "official_completeness_verified": false,
  "official_coverage_percent": null,
  "candidate_topics": [
    {
      "topic_fa": "حفاظت حریق",
      "source_id": "IR-M3",
      "candidate_edition": 1395,
      "official_current_exam_confirmed": false,
      "v1_relevance": "PLAN",
      "rule_ids": [],
      "coverage": "INPUT_REQUIRED",
      "gap": "Full occupancy/egress extraction and errata pending",
      "action": "Verify current official exam notice and full relevant source before release"
    },
    {
      "topic_fa": "غلطنامه مبحث۳",
      "source_id": "IR-M3",
      "candidate_edition": null,
      "official_current_exam_confirmed": false,
      "v1_relevance": "PLAN",
      "rule_ids": [],
      "coverage": "INPUT_REQUIRED",
      "gap": "Exact official errata unavailable",
      "action": "Verify current official exam notice and full relevant source before release"
    },
    {
      "topic_fa": "الزامات عمومی",
      "source_id": "IR-M4",
      "candidate_edition": 1396,
      "official_current_exam_confirmed": false,
      "v1_relevance": "PLAN",
      "rule_ids": [
        "ARCH-RES-LIVING-001",
        "ARCH-RES-LIVING-002",
        "ARCH-RES-BEDROOM-001",
        "ARCH-RES-LIVING-003",
        "ARCH-RES-CIRCULATION-001",
        "ARCH-RES-STAIRS-001",
        "ARCH-RES-STAIRS-002",
        "ARCH-RES-STAIRS-003",
        "ARCH-RES-KITCHEN-001",
        "ARCH-RES-KITCHEN-002",
        "ARCH-RES-KITCHEN-003",
        "ARCH-RES-KITCHEN-004",
        "ARCH-RES-DAYLIGHT-001",
        "ARCH-RES-VENTILATION-001",
        "ARCH-RES-WC-001",
        "ARCH-RES-BATHROOM-001",
        "ARCH-RES-BATHROOM-002",
        "ARCH-RES-ACCESSIBILITY-001",
        "ARCH-RES-PRIVACY-001",
        "ARCH-RES-PRIVACY-002",
        "ARCH-RES-PRIVACY-003",
        "ARCH-RES-BALCONY-001",
        "ARCH-RES-DAYLIGHT-002",
        "ARCH-RES-DAYLIGHT-003",
        "ARCH-RES-DAYLIGHT-004",
        "ARCH-RES-DAYLIGHT-005",
        "ARCH-RES-DOOR-001",
        "ARCH-RES-EGRESS-001",
        "ARCH-RES-KITCHEN-005",
        "ARCH-RES-VENTILATION-002",
        "ARCH-RES-DAYLIGHT-006",
        "ARCH-RES-DAYLIGHT-007"
      ],
      "coverage": "PARTIAL",
      "gap": "32 extracted clauses; comprehensive applicability/amendment audit pending",
      "action": "Verify current official exam notice and full relevant source before release"
    },
    {
      "topic_fa": "پیوست حفاظتی انتظامی",
      "source_id": "IR-M4-SECURITY",
      "candidate_edition": null,
      "official_current_exam_confirmed": false,
      "v1_relevance": "PLAN",
      "rule_ids": [],
      "coverage": "INPUT_REQUIRED",
      "gap": "1402 request vs1403 lead conflict; exact source pending",
      "action": "Verify current official exam notice and full relevant source before release"
    },
    {
      "topic_fa": "آسانسور و پله برقی",
      "source_id": "IR-M15",
      "candidate_edition": 1392,
      "official_current_exam_confirmed": false,
      "v1_relevance": "PLAN_DESIGN_ONLY",
      "rule_ids": [],
      "coverage": "INPUT_REQUIRED",
      "gap": "Plan-design clauses pending; escalator details deferred",
      "action": "Verify current official exam notice and full relevant source before release"
    },
    {
      "topic_fa": "عایق‌بندی و تنظیم صدا",
      "source_id": "IR-M18",
      "candidate_edition": 1396,
      "official_current_exam_confirmed": false,
      "v1_relevance": "PLAN_COORDINATION",
      "rule_ids": [],
      "coverage": "INPUT_REQUIRED",
      "gap": "Uploaded filename1402 but cover1396; adjacency/acoustic clauses pending",
      "action": "Verify current official exam notice and full relevant source before release"
    },
    {
      "topic_fa": "صرفه‌جویی/مدیریت انرژی",
      "source_id": "IR-M19-4",
      "candidate_edition": 1399,
      "official_current_exam_confirmed": false,
      "v1_relevance": "PLAN_COORDINATION",
      "rule_ids": [],
      "coverage": "INPUT_REQUIRED",
      "gap": "Both1399/1404 permitted in transition; complete edition-specific extraction pending",
      "action": "Verify current official exam notice and full relevant source before release"
    },
    {
      "topic_fa": "مبانی طراحی معماری",
      "source_id": "IR-EXAM",
      "candidate_edition": null,
      "official_current_exam_confirmed": false,
      "v1_relevance": "PLAN",
      "rule_ids": [],
      "coverage": "INPUT_REQUIRED",
      "gap": "No single official textbook inferred; current official exam topic list unresolved",
      "action": "Verify current official exam notice and full relevant source before release"
    },
    {
      "topic_fa": "جزئیات اجرایی ساختمان",
      "source_id": "IR-EXAM",
      "candidate_edition": null,
      "official_current_exam_confirmed": false,
      "v1_relevance": "PARTIAL_DEFERRED",
      "rule_ids": [],
      "coverage": "INPUT_REQUIRED",
      "gap": "Floor-plan wall/opening dependencies relevant; sections/elevations/details deferred",
      "action": "Verify current official exam notice and full relevant source before release"
    },
    {
      "topic_fa": "ضوابط افراد دارای معلولیت",
      "source_id": "IR-ACCESS",
      "candidate_edition": 1399,
      "official_current_exam_confirmed": false,
      "v1_relevance": "PLAN",
      "rule_ids": [],
      "coverage": "INPUT_REQUIRED",
      "gap": "Third edition candidate source not yet independently read",
      "action": "Verify current official exam notice and full relevant source before release"
    }
  ],
  "additional_project_authorities": [
    "municipal permit/setbacks/density/parking",
    "national accessibility applicability",
    "structural nonstructural interfaces",
    "energy transitional notice"
  ],
  "notes": "Exam list is not exhaustive legal authority for a particular parcel. Current official INBR list inaccessible; candidate matrix must not be labelled complete."
}
